{"schemaVersion":"1.0.0","orchestrationId":"2026-10-24-opencode2-post-restart","goal":"Verify restarted researcher WebFetch access, determine requirements for the latest OpenCode 2, implement evidence-backed harness compatibility changes and independently validate regressions.","deliverables":["Primary-source release/API evidence and exact OpenCode 2 compatibility plan","Scoped harness changes preserving the four existing WebFetch edits","Independent read-only acceptance evidence and honest full-runtime verification limits"],"nonGoals":["Live provider activation and credentials","Global config, Git mutation and publication"],"allowedPaths":["bin/",".opencode/","package.json","package-lock.json","README.md","AGENTS.md","opencode-harness.design.md"],"workUnits":[{"id":"upgrade","goal":"Research upstream OpenCode 2 and upgrade only verified harness compatibility gaps","deliverable":"Evidence-backed changes and independent regression assessment","nonGoals":["Live provider activation and global/Git mutation"],"allowedPaths":["bin/",".opencode/","package.json","package-lock.json","README.md","AGENTS.md","opencode-harness.design.md"],"acceptanceGateIds":["diff-integrity","plugin-syntax"]}],"acceptanceGates":[{"id":"diff-integrity","criterion":"No whitespace errors in resulting tracked changes","evidenceCommand":"git diff --check","workUnitIds":["upgrade"]},{"id":"plugin-syntax","criterion":"Native plugin entry parses under Node","evidenceCommand":"node --check .opencode/plugins/index.js","workUnitIds":["upgrade"]}],"roleModeTaskMapping":[{"workUnitId":"upgrade","role":"researcher","taskMode":"research","boundedTask":"Attempt live WebFetch to primary upstream release/API references and identify exact current OpenCode 2 compatibility requirements."},{"workUnitId":"upgrade","role":"planner","taskMode":"plan","boundedTask":"Specify exact evidence-backed file contracts and meaningful regression checks or state blocker."},{"workUnitId":"upgrade","role":"implementer","taskMode":"implementation","boundedTask":"Apply approved scoped compatibility changes preserving pre-existing WebFetch work."},{"workUnitId":"upgrade","role":"validator","taskMode":"validation","boundedTask":"Independently assess changed behavior and exact assigned read-only gates."}],"dag":{"dependencies":[{"workUnitId":"upgrade","dependsOn":[]}],"parallelism":{"mode":"serial","authorization":"not-authorized","distinctCapacityEvidence":null}},"budgets":{"defaultRemediationCyclesPerWorkUnit":1,"maxRemediationCyclesPerWorkUnit":1,"maxTotalLeafAgents":6,"maxLeafAgentsByRole":{"researcher":1,"planner":1,"implementer":2,"validator":2}},"scopeExpansion":{"policy":"deny","requiresUserApproval":true},"authorization":{"liveProviders":false,"userGlobalMutation":false,"git":{"commit":false,"amend":false,"push":false,"otherMutation":false}},"routingMetadataStatus":"absent"}
