{"schemaVersion":"1.0.0","orchestrationId":"2026-10-24-opencode2-pinned-contract","goal":"Research exact pinned OpenCode v2.1.4 plugin/CLI/SDK contracts and implement only verified safe harness compatibility changes with independent validation.","deliverables":["Pinned upstream v2.1.4 source-backed API and package compatibility matrix","Exact scoped implementation or explicit evidence-backed blocker","Independent read-only command-backed regression findings"],"nonGoals":["Live provider activation or credentials","User-global configuration, Git mutation and publication"],"allowedPaths":["bin/",".opencode/","package.json","package-lock.json","README.md","AGENTS.md","opencode-harness.design.md"],"workUnits":[{"id":"pinned-contract","goal":"Port harness against confirmed v2.1.4 API only when exact guard equivalence can be established","deliverable":"Evidence-based implementation and independent validation, or blocker","nonGoals":["Guessing APIs or weakening dispatch boundaries"],"allowedPaths":["bin/",".opencode/","package.json","package-lock.json","README.md","AGENTS.md","opencode-harness.design.md"],"acceptanceGateIds":["diff-integrity","entry-syntax"]}],"acceptanceGates":[{"id":"diff-integrity","criterion":"No whitespace errors in tracked changes","evidenceCommand":"git diff --check","workUnitIds":["pinned-contract"]},{"id":"entry-syntax","criterion":"Projected plugin entry parses","evidenceCommand":"node --check .opencode/plugins/index.js","workUnitIds":["pinned-contract"]}],"roleModeTaskMapping":[{"workUnitId":"pinned-contract","role":"researcher","taskMode":"research","boundedTask":"Retrieve pinned V2 source/SDK registration and package/CLI contracts with exact citations and compare to local guard."},{"workUnitId":"pinned-contract","role":"planner","taskMode":"plan","boundedTask":"Specify safe narrow edits only if exact API contracts support them; otherwise block."},{"workUnitId":"pinned-contract","role":"implementer","taskMode":"implementation","boundedTask":"Implement supported scoped V2 changes preserving WebFetch and security invariants."},{"workUnitId":"pinned-contract","role":"validator","taskMode":"validation","boundedTask":"Independently validate exact managed gates and changed behavior, reporting external QA limitations."}],"dag":{"dependencies":[{"workUnitId":"pinned-contract","dependsOn":[]}],"parallelism":{"mode":"serial","authorization":"not-authorized","distinctCapacityEvidence":null}},"budgets":{"defaultRemediationCyclesPerWorkUnit":1,"maxRemediationCyclesPerWorkUnit":1,"maxTotalLeafAgents":6,"maxLeafAgentsByRole":{"researcher":1,"planner":1,"implementer":2,"validator":2}},"scopeExpansion":{"policy":"deny","requiresUserApproval":true},"authorization":{"liveProviders":false,"userGlobalMutation":false,"git":{"commit":false,"amend":false,"push":false,"otherMutation":false}},"routingMetadataStatus":"absent"}
