{"schemaVersion":"1.0.0","orchestrationId":"2026-10-24-opencode2-fresh-validation","goal":"Independently reconcile current staged OpenCode v2.1.4 upgrade changes and complete all feasible managed read-only validation, explicitly separating unexecuted external binary/runtime/package QA.","deliverables":["Observed exact-tree change inventory and read-only command evidence","Independent bounded findings about staged docs, fixture, WebFetch fix and remaining V2 upgrade gates","Explicit handoff for already-authorized external verification"],"nonGoals":["Claim native V2 support without binary or Task proof","Live providers, user-global mutation, Git mutation, or publication"],"allowedPaths":[".opencode/","bin/","README.md","opencode-harness.design.md","package.json","package-lock.json"],"workUnits":[{"id":"staged-validation","goal":"Validate staged work and establish exact unresolved external gates","deliverable":"Independent command-backed inventory and validation matrix","nonGoals":["Workspace edits, live network or unsupported write-producing managed QA"],"allowedPaths":[".opencode/","bin/","README.md","opencode-harness.design.md","package.json","package-lock.json"],"acceptanceGateIds":["inventory","whitespace","launcher-syntax","plugin-syntax","module-syntax","test-syntax"]}],"acceptanceGates":[{"id":"inventory","criterion":"Observe tracked changed-file names on the current tree","evidenceCommand":"git diff --name-only","workUnitIds":["staged-validation"]},{"id":"whitespace","criterion":"No tracked diff whitespace errors","evidenceCommand":"git diff --check","workUnitIds":["staged-validation"]},{"id":"launcher-syntax","criterion":"Projected launcher parses","evidenceCommand":"node --check bin/opencode-harness.mjs","workUnitIds":["staged-validation"]},{"id":"plugin-syntax","criterion":"Auto-loaded plugin entry parses","evidenceCommand":"node --check .opencode/plugins/index.js","workUnitIds":["staged-validation"]},{"id":"module-syntax","criterion":"Changed projected WebFetch guard parses","evidenceCommand":"node --check .opencode/plugin-modules/managed-execution.js","workUnitIds":["staged-validation"]},{"id":"test-syntax","criterion":"Changed projected WebFetch policy tests parse","evidenceCommand":"node --check .opencode/plugin-modules/managed-execution.test.mjs","workUnitIds":["staged-validation"]}],"roleModeTaskMapping":[{"workUnitId":"staged-validation","role":"validator","taskMode":"validation","boundedTask":"Run exact read-only inventory and syntax gates, review staged change scope, and distinguish passed checks from external QA that remains blocked."}],"dag":{"dependencies":[{"workUnitId":"staged-validation","dependsOn":[]}],"parallelism":{"mode":"serial","authorization":"not-authorized","distinctCapacityEvidence":null}},"budgets":{"defaultRemediationCyclesPerWorkUnit":1,"maxRemediationCyclesPerWorkUnit":0,"maxTotalLeafAgents":1,"maxLeafAgentsByRole":{"researcher":0,"planner":0,"implementer":0,"validator":1}},"scopeExpansion":{"policy":"deny","requiresUserApproval":true},"authorization":{"liveProviders":false,"userGlobalMutation":false,"git":{"commit":false,"amend":false,"push":false,"otherMutation":false}},"routingMetadataStatus":"absent"}
