{"schemaVersion":"1.0.0","orchestrationId":"2026-10-24-webfetch-fixture-revert","goal":"Revert the unsafe test-only /tmp fixture prefix change while keeping the researcher WebFetch production fix and network-free policy cases.","deliverables":["Paired tests restored to original /var/tmp fixture prefix","Independent read-only diff and syntax evidence"],"nonGoals":["Production code changes","Live network, global config, Git mutation"],"allowedPaths":[".opencode/src/plugin-modules/managed-execution.test.ts",".opencode/plugin-modules/managed-execution.test.mjs"],"workUnits":[{"id":"revert","goal":"Restore original fixture prefixes without changing assertions","deliverable":"Paired tests use original /var/tmp fixture root","nonGoals":["Production changes and live network"],"allowedPaths":[".opencode/src/plugin-modules/managed-execution.test.ts",".opencode/plugin-modules/managed-execution.test.mjs"],"acceptanceGateIds":["diff-check","test-syntax"]}],"acceptanceGates":[{"id":"diff-check","criterion":"Changed tree has no whitespace errors","evidenceCommand":"git diff --check","workUnitIds":["revert"]},{"id":"test-syntax","criterion":"Paired generated JS test parses","evidenceCommand":"node --check .opencode/plugin-modules/managed-execution.test.mjs","workUnitIds":["revert"]}],"roleModeTaskMapping":[{"workUnitId":"revert","role":"implementer","taskMode":"implementation","boundedTask":"Restore only original /var/tmp fixture prefixes in paired test files."},{"workUnitId":"revert","role":"validator","taskMode":"validation","boundedTask":"Independently confirm restored prefixes and assigned gate exits."}],"dag":{"dependencies":[{"workUnitId":"revert","dependsOn":[]}],"parallelism":{"mode":"serial","authorization":"not-authorized","distinctCapacityEvidence":null}},"budgets":{"defaultRemediationCyclesPerWorkUnit":1,"maxRemediationCyclesPerWorkUnit":0,"maxTotalLeafAgents":2,"maxLeafAgentsByRole":{"researcher":0,"planner":0,"implementer":1,"validator":1}},"scopeExpansion":{"policy":"deny","requiresUserApproval":true},"authorization":{"liveProviders":false,"userGlobalMutation":false,"git":{"commit":false,"amend":false,"push":false,"otherMutation":false}},"routingMetadataStatus":"absent"}
