{"schemaVersion":"1.0.0","orchestrationId":"2026-10-24-webfetch-private-tmp-tests","goal":"Run paired managed WebFetch policy tests with test fixtures directed to the managed verifier private temporary directory.","deliverables":["Independent exit-code and assertion evidence for both paired tests"],"nonGoals":["Live WebFetch","Source changes and Git mutation"],"allowedPaths":[".opencode/"],"workUnits":[{"id":"private-tmp-tests","goal":"Run paired policy suites with TMPDIR=/tmp","deliverable":"Observed test assertions and exits","nonGoals":["Network calls and source changes"],"allowedPaths":[".opencode/"],"acceptanceGateIds":["ts-test","js-test"]}],"acceptanceGates":[{"id":"ts-test","criterion":"TypeScript suite passes with private fixture storage","evidenceCommand":"env TMPDIR=/tmp node --test .opencode/src/plugin-modules/managed-execution.test.ts","workUnitIds":["private-tmp-tests"]},{"id":"js-test","criterion":"Generated JavaScript suite passes with private fixture storage","evidenceCommand":"env TMPDIR=/tmp node --test .opencode/plugin-modules/managed-execution.test.mjs","workUnitIds":["private-tmp-tests"]}],"roleModeTaskMapping":[{"workUnitId":"private-tmp-tests","role":"validator","taskMode":"validation","boundedTask":"Independently run both exact paired test commands and record exits and boundary evidence."}],"dag":{"dependencies":[{"workUnitId":"private-tmp-tests","dependsOn":[]}],"parallelism":{"mode":"serial","authorization":"not-authorized","distinctCapacityEvidence":null}},"budgets":{"defaultRemediationCyclesPerWorkUnit":1,"maxRemediationCyclesPerWorkUnit":0,"maxTotalLeafAgents":1,"maxLeafAgentsByRole":{"researcher":0,"planner":0,"implementer":0,"validator":1}},"scopeExpansion":{"policy":"deny","requiresUserApproval":true},"authorization":{"liveProviders":false,"userGlobalMutation":false,"git":{"commit":false,"amend":false,"push":false,"otherMutation":false}},"routingMetadataStatus":"absent"}
