{"schemaVersion":"1.0.0","orchestrationId":"2026-10-24-v2-native-fixture","goal":"Build and validate a source-only, credential-free OpenCode v2.1.4 native plugin fixture to break the evidence-before-production-port deadlock while leaving V1 runtime and managed dispatch unchanged.","deliverables":["Pinned-source-backed fixture contract for plugin setup and before-subagent rejection without live provider use","Source-only executable fixture and focused tests if exact native semantics permit, or command-backed blocker","Independent read-only integrity/syntax evidence and external operator-run handoff"],"nonGoals":["Production V2 managed dispatch or modifying V1 runtime plugin/launcher","Live providers, credentials, global install/config, Git mutation and publication"],"allowedPaths":[".opencode/scripts/",".opencode/harness.manifest.json","README.md","opencode-harness.design.md"],"workUnits":[{"id":"native-fixture","goal":"Construct a disposable offline V2 plugin probe outside production runtime with explicit stop conditions","deliverable":"Bounded native fixture and evidence matrix or precise blocker","nonGoals":["Shipping a V2 plugin or enabling native V2 Task dispatch"],"allowedPaths":[".opencode/scripts/",".opencode/harness.manifest.json","README.md","opencode-harness.design.md"],"acceptanceGateIds":["diff-integrity","runner-syntax"]}],"acceptanceGates":[{"id":"diff-integrity","criterion":"No whitespace errors in staged source changes","evidenceCommand":"git diff --check","workUnitIds":["native-fixture"]},{"id":"runner-syntax","criterion":"The operator runner still parses after source-only fixture changes","evidenceCommand":"node --check .opencode/scripts/operator-external-qa.mts","workUnitIds":["native-fixture"]}],"roleModeTaskMapping":[{"workUnitId":"native-fixture","role":"researcher","taskMode":"research","boundedTask":"Identify pinned V2 CLI/plugin configuration surfaces that can load a disposable probe and reject subagent before child creation without provider activation."},{"workUnitId":"native-fixture","role":"planner","taskMode":"plan","boundedTask":"Specify exact source-only test harness, stop conditions and no-provider checks, or block if impossible."},{"workUnitId":"native-fixture","role":"implementer","taskMode":"implementation","boundedTask":"Create approved source-only V2 native fixture and paired deterministic checks; no production V1/V2 integration edits."},{"workUnitId":"native-fixture","role":"validator","taskMode":"validation","boundedTask":"Independently inspect fixture scope and run assigned read-only gates, reporting native external execution as separate evidence."}],"dag":{"dependencies":[{"workUnitId":"native-fixture","dependsOn":[]}],"parallelism":{"mode":"serial","authorization":"not-authorized","distinctCapacityEvidence":null}},"budgets":{"defaultRemediationCyclesPerWorkUnit":1,"maxRemediationCyclesPerWorkUnit":1,"maxTotalLeafAgents":6,"maxLeafAgentsByRole":{"researcher":1,"planner":1,"implementer":2,"validator":2}},"scopeExpansion":{"policy":"deny","requiresUserApproval":true},"authorization":{"liveProviders":false,"userGlobalMutation":false,"git":{"commit":false,"amend":false,"push":false,"otherMutation":false}},"routingMetadataStatus":"absent"}
