{"schemaVersion":"1.0.0","orchestrationId":"2026-10-24-webfetch-focused-tests","goal":"Independently run focused network-free TypeScript and generated JavaScript policy tests for the repaired managed WebFetch behavior.","deliverables":["Command-backed results of both focused policy test suites on the current tree"],"nonGoals":["Live network requests","Source edits, global config, Git mutation and publication"],"allowedPaths":[".opencode/"],"workUnits":[{"id":"focused-tests","goal":"Independently execute both paired managed-execution policy suites","deliverable":"Observed exit codes and security-boundary findings","nonGoals":["Live WebFetch and source changes"],"allowedPaths":[".opencode/"],"acceptanceGateIds":["typescript-policy","generated-policy"]}],"acceptanceGates":[{"id":"typescript-policy","criterion":"TypeScript managed tool policy tests pass without network","evidenceCommand":"node --test .opencode/src/plugin-modules/managed-execution.test.ts","workUnitIds":["focused-tests"]},{"id":"generated-policy","criterion":"Generated JavaScript managed tool policy tests pass without network","evidenceCommand":"node --test .opencode/plugin-modules/managed-execution.test.mjs","workUnitIds":["focused-tests"]}],"roleModeTaskMapping":[{"workUnitId":"focused-tests","role":"validator","taskMode":"validation","boundedTask":"Run both exact focused read-only tests and record independently observed exits and tree proof."}],"dag":{"dependencies":[{"workUnitId":"focused-tests","dependsOn":[]}],"parallelism":{"mode":"serial","authorization":"not-authorized","distinctCapacityEvidence":null}},"budgets":{"defaultRemediationCyclesPerWorkUnit":1,"maxRemediationCyclesPerWorkUnit":0,"maxTotalLeafAgents":1,"maxLeafAgentsByRole":{"researcher":0,"planner":0,"implementer":0,"validator":1}},"scopeExpansion":{"policy":"deny","requiresUserApproval":true},"authorization":{"liveProviders":false,"userGlobalMutation":false,"git":{"commit":false,"amend":false,"push":false,"otherMutation":false}},"routingMetadataStatus":"absent"}
