{"schemaVersion":"1.0.0","orchestrationId":"2026-10-24-webfetch-fixture-repair","goal":"Repair paired WebFetch policy-test fixture paths to work in the managed verifier private temporary directory and validate both suites.","deliverables":["Scoped fixture-path fix in TypeScript and generated JavaScript tests","Independent observed paired-suite exit statuses and boundary evidence"],"nonGoals":["Live network access","Production behavior change, global config, Git mutation"],"allowedPaths":[".opencode/src/plugin-modules/managed-execution.test.ts",".opencode/plugin-modules/managed-execution.test.mjs"],"workUnits":[{"id":"fixture","goal":"Replace hardcoded read-only /var/tmp fixture root with private-temp-compatible path in paired tests","deliverable":"Passing network-free paired policy tests","nonGoals":["Production code, live network, Git mutation"],"allowedPaths":[".opencode/src/plugin-modules/managed-execution.test.ts",".opencode/plugin-modules/managed-execution.test.mjs"],"acceptanceGateIds":["ts-test","js-test"]}],"acceptanceGates":[{"id":"ts-test","criterion":"TypeScript suite executes assertions with private fixtures","evidenceCommand":"env TMPDIR=/tmp node --test .opencode/src/plugin-modules/managed-execution.test.ts","workUnitIds":["fixture"]},{"id":"js-test","criterion":"Generated JS suite executes assertions with private fixtures","evidenceCommand":"env TMPDIR=/tmp node --test .opencode/plugin-modules/managed-execution.test.mjs","workUnitIds":["fixture"]}],"roleModeTaskMapping":[{"workUnitId":"fixture","role":"planner","taskMode":"plan","boundedTask":"Specify minimal paired fixture edit and acceptance from failed validator evidence."},{"workUnitId":"fixture","role":"implementer","taskMode":"implementation","boundedTask":"Make paired fixture paths respect managed private temporary directory without changing assertions."},{"workUnitId":"fixture","role":"validator","taskMode":"validation","boundedTask":"Independently run paired test gates and record exact results."}],"dag":{"dependencies":[{"workUnitId":"fixture","dependsOn":[]}],"parallelism":{"mode":"serial","authorization":"not-authorized","distinctCapacityEvidence":null}},"budgets":{"defaultRemediationCyclesPerWorkUnit":1,"maxRemediationCyclesPerWorkUnit":1,"maxTotalLeafAgents":4,"maxLeafAgentsByRole":{"researcher":0,"planner":1,"implementer":1,"validator":2}},"scopeExpansion":{"policy":"deny","requiresUserApproval":true},"authorization":{"liveProviders":false,"userGlobalMutation":false,"git":{"commit":false,"amend":false,"push":false,"otherMutation":false}},"routingMetadataStatus":"absent"}
