{"schemaVersion":"1.0.0","orchestrationId":"2026-10-24-qa-execution-boundary","goal":"Investigate and, where feasible, fix harness-owned obstacles preventing previously authorized external source/runtime/package QA and credential-free OpenCode V2 artifact checks, without weakening managed delegation safeguards.","deliverables":["Command/source-backed root-cause map distinguishing managed isolation, missing runner, test-fixture limitations and separate native V2 evidence","Narrow in-scope implementation for an explicit external-QA execution/handoff boundary if supported, otherwise a concrete blocker","Independent read-only regression and security-boundary evidence"],"nonGoals":["Implicit unrestricted managed shell, network or workspace mutation","Live provider activation, global installation/config, Git mutation or publication"],"allowedPaths":[".opencode/","bin/","README.md","AGENTS.md","opencode-harness.design.md","package.json"],"workUnits":[{"id":"qa-boundary","goal":"Separate and enable explicitly authorized external verification from managed read-only gates while preserving fail-closed dispatch","deliverable":"Audited narrow harness change or justified no-change handoff","nonGoals":["Broad bypass of shell, tool or task-thread guardrails"],"allowedPaths":[".opencode/","bin/","README.md","AGENTS.md","opencode-harness.design.md","package.json"],"acceptanceGateIds":["tracked-inventory","diff-check","plugin-syntax"]}],"acceptanceGates":[{"id":"tracked-inventory","criterion":"Observe tracked source change inventory","evidenceCommand":"git diff --name-only","workUnitIds":["qa-boundary"]},{"id":"diff-check","criterion":"No whitespace errors","evidenceCommand":"git diff --check","workUnitIds":["qa-boundary"]},{"id":"plugin-syntax","criterion":"Plugin entry parses without guard regression","evidenceCommand":"node --check .opencode/plugins/index.js","workUnitIds":["qa-boundary"]}],"roleModeTaskMapping":[{"workUnitId":"qa-boundary","role":"researcher","taskMode":"research","boundedTask":"Trace exact refusal causes and existing authorized external-verification mechanisms; distinguish harness design from environment."},{"workUnitId":"qa-boundary","role":"planner","taskMode":"plan","boundedTask":"Select exact safe harness edit contract to unblock authorized external QA or state why none is justified."},{"workUnitId":"qa-boundary","role":"implementer","taskMode":"implementation","boundedTask":"Implement approved narrow external-QA boundary fix without granting managed shell or child extra capabilities."},{"workUnitId":"qa-boundary","role":"validator","taskMode":"validation","boundedTask":"Independently run assigned read-only gates and assess changed boundaries against goal."}],"dag":{"dependencies":[{"workUnitId":"qa-boundary","dependsOn":[]}],"parallelism":{"mode":"serial","authorization":"not-authorized","distinctCapacityEvidence":null}},"budgets":{"defaultRemediationCyclesPerWorkUnit":1,"maxRemediationCyclesPerWorkUnit":1,"maxTotalLeafAgents":6,"maxLeafAgentsByRole":{"researcher":1,"planner":1,"implementer":2,"validator":2}},"scopeExpansion":{"policy":"deny","requiresUserApproval":true},"authorization":{"liveProviders":false,"userGlobalMutation":false,"git":{"commit":false,"amend":false,"push":false,"otherMutation":false}},"routingMetadataStatus":"absent"}
