{"schemaVersion":"1.0.0","orchestrationId":"2026-10-24-v2-artifact-provenance","goal":"Determine official OpenCode v2.1.4 artifact provenance and exact credential-free offline compatibility checks authorized by the user, then independently assess readiness for external verification.","deliverables":["Verified official V2 artifact URL and integrity/checksum evidence, or explicit uncertainty","Exact isolated offline verification handoff and remaining managed-boundary blockers","Independent read-only gate and scope evidence"],"nonGoals":["Live provider activation or credentials","Global installation, Git mutation or publication"],"allowedPaths":[".opencode/","bin/","package.json","package-lock.json","README.md","opencode-harness.design.md"],"workUnits":[{"id":"artifact","goal":"Research official V2 artifact and prepare isolated verification without guessing authenticity","deliverable":"Evidence-backed download and offline test handoff","nonGoals":["Executing a real provider, user-global config or Git mutation"],"allowedPaths":[".opencode/","bin/","package.json","package-lock.json","README.md","opencode-harness.design.md"],"acceptanceGateIds":["tree-diff"]}],"acceptanceGates":[{"id":"tree-diff","criterion":"No new whitespace errors in tracked tree while investigating","evidenceCommand":"git diff --check","workUnitIds":["artifact"]}],"roleModeTaskMapping":[{"workUnitId":"artifact","role":"researcher","taskMode":"research","boundedTask":"Use WebFetch to verify tagged v2.1.4 official Linux release artifact and integrity evidence, and identify native Task contracts."},{"workUnitId":"artifact","role":"planner","taskMode":"plan","boundedTask":"Prepare precise isolated artifact verification and external QA handoff within granted authority; identify unavailable execution surfaces."},{"workUnitId":"artifact","role":"validator","taskMode":"validation","boundedTask":"Independently run assigned read-only gate and review source-backed provenance and limits."}],"dag":{"dependencies":[{"workUnitId":"artifact","dependsOn":[]}],"parallelism":{"mode":"serial","authorization":"not-authorized","distinctCapacityEvidence":null}},"budgets":{"defaultRemediationCyclesPerWorkUnit":1,"maxRemediationCyclesPerWorkUnit":0,"maxTotalLeafAgents":3,"maxLeafAgentsByRole":{"researcher":1,"planner":1,"implementer":0,"validator":1}},"scopeExpansion":{"policy":"deny","requiresUserApproval":true},"authorization":{"liveProviders":false,"userGlobalMutation":false,"git":{"commit":false,"amend":false,"push":false,"otherMutation":false}},"routingMetadataStatus":"absent"}
