{
  "schemaVersion":"1.0.0","orchestrationId":"2026-10-24-managed-webfetch-repair","goal":"Investigate and repair the managed researcher WebFetch unavailability while preserving safe delegation boundaries, then independently validate the repair.",
  "deliverables":["Evidence-backed diagnosis of why managed researcher WebFetch was unavailable","Scoped harness fix and regression tests if the cause is in this repository","Independent command-backed validation and explicit limits on live network behavior"],
  "nonGoals":["Live provider activation or credential changes","Global config, Git mutation and publication"],
  "allowedPaths":[".opencode/","bin/","package.json","README.md"],
  "workUnits":[{"id":"webfetch","goal":"Diagnose and fix WebFetch availability for managed researchers without opening arbitrary mutation tools","deliverable":"Source fix with focused checks and independent validation","nonGoals":["Credential changes, global configuration and Git mutation"],"allowedPaths":[".opencode/","bin/","package.json","README.md"],"acceptanceGateIds":["diff-check","plugin-check"]}],
  "acceptanceGates":[{"id":"diff-check","criterion":"No whitespace errors in current changes","evidenceCommand":"git diff --check","workUnitIds":["webfetch"]},{"id":"plugin-check","criterion":"Auto-loaded plugin entry parses","evidenceCommand":"node --check .opencode/plugins/index.js","workUnitIds":["webfetch"]}],
  "roleModeTaskMapping":[{"workUnitId":"webfetch","role":"researcher","taskMode":"research","boundedTask":"Trace managed WebFetch denial and identify in-repository cause and security boundaries."},{"workUnitId":"webfetch","role":"planner","taskMode":"plan","boundedTask":"Choose precise fix and test file contracts for managed read-only WebFetch."},{"workUnitId":"webfetch","role":"implementer","taskMode":"implementation","boundedTask":"Implement approved scoped fix and focused tests without clobbering existing changes."},{"workUnitId":"webfetch","role":"validator","taskMode":"validation","boundedTask":"Independently check gate exits, focused behavior, security boundary and limitations."}],
  "dag":{"dependencies":[{"workUnitId":"webfetch","dependsOn":[]}],"parallelism":{"mode":"serial","authorization":"not-authorized","distinctCapacityEvidence":null}},
  "budgets":{"defaultRemediationCyclesPerWorkUnit":1,"maxRemediationCyclesPerWorkUnit":1,"maxTotalLeafAgents":7,"maxLeafAgentsByRole":{"researcher":1,"planner":1,"implementer":2,"validator":3}},
  "scopeExpansion":{"policy":"deny","requiresUserApproval":true},"authorization":{"liveProviders":false,"userGlobalMutation":false,"git":{"commit":false,"amend":false,"push":false,"otherMutation":false}},"routingMetadataStatus":"absent"
}
