{"schemaVersion":"1.0.0","orchestrationId":"2026-10-24-v2-native-guard-port","goal":"Use verified OpenCode v2.1.4 artifact and pinned upstream contracts to implement necessary V2 harness launcher/plugin/Task-guard changes while preserving existing V1 and WebFetch behavior, then independently validate feasible gates.","deliverables":["Exact source-backed V2 native plugin, CLI, Task and configuration compatibility matrix","Bounded implementation of only verifiable V2 support or an explicit fail-closed blocker","Independent exact-tree managed checks and separate external full QA handoff"],"nonGoals":["Speculative V2 managed dispatch or weakening Task identity and acceptance guards","Live provider activation, credentials, user-global configuration, Git mutation or publication"],"allowedPaths":["bin/",".opencode/","package.json","package-lock.json","README.md","opencode-harness.design.md"],"workUnits":[{"id":"v2-port","goal":"Research, plan and conditionally implement V2 native compatibility on the verified 2.1.4 boundary","deliverable":"Safe V2 adaptation with independent validation, or precise remaining blocker","nonGoals":["Activation without proven pre-spawn Task guard and complete native contracts"],"allowedPaths":["bin/",".opencode/","package.json","package-lock.json","README.md","opencode-harness.design.md"],"acceptanceGateIds":["diff-integrity","launcher-syntax","plugin-syntax"]}],"acceptanceGates":[{"id":"diff-integrity","criterion":"Current implementation has no whitespace errors","evidenceCommand":"git diff --check","workUnitIds":["v2-port"]},{"id":"launcher-syntax","criterion":"Generated launcher parses after any V2 change","evidenceCommand":"node --check bin/opencode-harness.mjs","workUnitIds":["v2-port"]},{"id":"plugin-syntax","criterion":"Generated plugin entry parses after any V2 change","evidenceCommand":"node --check .opencode/plugins/index.js","workUnitIds":["v2-port"]}],"roleModeTaskMapping":[{"workUnitId":"v2-port","role":"researcher","taskMode":"research","boundedTask":"Cite pinned V2 source for plugin setup/config, before/after Task interception, parent/child event binding and CLI probe replacement against current V1 harness; distinguish verified binary evidence from missing native behavior."},{"workUnitId":"v2-port","role":"planner","taskMode":"plan","boundedTask":"Choose exact V2 file contracts and gates only where before-dispatch and identity safeguards can be maintained; otherwise define blocker and safe next steps."},{"workUnitId":"v2-port","role":"implementer","taskMode":"implementation","boundedTask":"Apply only approved evidence-backed V2 compatibility edits with paired source/generated/tests while preserving V1 and WebFetch changes."},{"workUnitId":"v2-port","role":"validator","taskMode":"validation","boundedTask":"Independently run declared read-only gates and review changed native boundary, reporting separate external QA limits."}],"dag":{"dependencies":[{"workUnitId":"v2-port","dependsOn":[]}],"parallelism":{"mode":"serial","authorization":"not-authorized","distinctCapacityEvidence":null}},"budgets":{"defaultRemediationCyclesPerWorkUnit":1,"maxRemediationCyclesPerWorkUnit":1,"maxTotalLeafAgents":6,"maxLeafAgentsByRole":{"researcher":1,"planner":1,"implementer":2,"validator":2}},"scopeExpansion":{"policy":"deny","requiresUserApproval":true},"authorization":{"liveProviders":false,"userGlobalMutation":false,"git":{"commit":false,"amend":false,"push":false,"otherMutation":false}},"routingMetadataStatus":"absent"}
